{
  "$schema": "https://json-schema.org/draft/2020-12/schema",
  "schema_ref": {
    "kind": "SCHEMA",
    "id": "urn:moirae:accord-02r5r3:schema:procedure-registry",
    "version": "0.2"
  },
  "$id": "urn:moirae:accord-02r5r3:procedure-registry:0.2",
  "object_id": "urn:moirae:accord-02r5r3:procedure-registry",
  "object_version": "0.2",
  "procedures": [
    {
      "procedure_id": "SCHEMA_VALIDATION",
      "arguments": [
        {
          "name": "registry",
          "kind": "REGISTRY",
          "required": true,
          "cardinality": "ONE"
        },
        {
          "name": "reference_model",
          "kind": "CONTRACT",
          "required": true,
          "cardinality": "ONE"
        }
      ],
      "derivation": {
        "operation": "VALIDATE_ACTIVE_UNIVERSE",
        "meta_validate_schemas": true,
        "validate_declared_instances": true,
        "universe_source": "registry:/objects/*",
        "model_source": "reference_model:/discovery_scope"
      },
      "result": {
        "type": "BOOLEAN",
        "status": [
          "PASS",
          "FAIL"
        ],
        "witness_required": true
      },
      "missing_behavior": "FAIL_CLOSED",
      "ambiguity_behavior": "FAIL_CLOSED",
      "fail_closed": true
    },
    {
      "procedure_id": "LINEAGE_VALIDATION",
      "arguments": [
        {
          "name": "package",
          "kind": "PACKAGE",
          "required": true,
          "cardinality": "ONE"
        },
        {
          "name": "authority",
          "kind": "AUTHORITY",
          "required": true,
          "cardinality": "ONE"
        }
      ],
      "derivation": {
        "operation": "SECTION_ENTAILMENT",
        "comparisons": [
          {
            "left": "package:/package_id",
            "right": "authority:/package_requirements/family"
          },
          {
            "left": "package:/package_version",
            "right": "authority:/package_requirements/version"
          },
          {
            "left": "package:/status",
            "right": "authority:/package_requirements/status"
          }
        ],
        "required_lineage_entry": "authority:/package_requirements/required_rejected_revision"
      },
      "result": {
        "type": "BOOLEAN",
        "status": [
          "PASS",
          "FAIL"
        ],
        "witness_required": true
      },
      "missing_behavior": "FAIL_CLOSED",
      "ambiguity_behavior": "FAIL_CLOSED",
      "fail_closed": true
    },
    {
      "procedure_id": "DUAL_INTEGRITY",
      "arguments": [
        {
          "name": "bindings",
          "kind": "CONTRACT",
          "required": true,
          "cardinality": "ONE"
        }
      ],
      "derivation": {
        "operation": "DIGEST_RECOMPUTE",
        "source_selector": "bindings:/sources/*",
        "semantic_serialization": "RFC8785_JCS",
        "raw_serialization": "RAW_BYTES",
        "algorithms": [
          "SHA-256"
        ]
      },
      "result": {
        "type": "BOOLEAN",
        "status": [
          "PASS",
          "FAIL"
        ],
        "witness_required": true
      },
      "missing_behavior": "FAIL_CLOSED",
      "ambiguity_behavior": "FAIL_CLOSED",
      "fail_closed": true
    },
    {
      "procedure_id": "UNIQUE_KEY",
      "arguments": [
        {
          "name": "registry",
          "kind": "REGISTRY",
          "required": true,
          "cardinality": "ONE"
        }
      ],
      "derivation": {
        "operation": "UNIQUE_KEY",
        "source": "registry:/objects/*",
        "projection": "registry:/identity_fields"
      },
      "result": {
        "type": "BOOLEAN",
        "status": [
          "PASS",
          "FAIL"
        ],
        "witness_required": true
      },
      "missing_behavior": "FAIL_CLOSED",
      "ambiguity_behavior": "FAIL_CLOSED",
      "fail_closed": true
    },
    {
      "procedure_id": "REFERENCE_RESOLUTION",
      "arguments": [
        {
          "name": "registry",
          "kind": "REGISTRY",
          "required": true,
          "cardinality": "ONE"
        },
        {
          "name": "reference_model",
          "kind": "CONTRACT",
          "required": true,
          "cardinality": "ONE"
        }
      ],
      "derivation": {
        "operation": "REFERENCE_RESOLUTION",
        "universe": "registry:/objects/*",
        "model": "reference_model:/shape_predicate",
        "scope": "reference_model:/discovery_scope",
        "edge_identity": "reference_model:/edge_identity",
        "cardinality": "reference_model:/resolution_cardinality"
      },
      "result": {
        "type": "BOOLEAN",
        "status": [
          "PASS",
          "FAIL"
        ],
        "witness_required": true
      },
      "missing_behavior": "FAIL_CLOSED",
      "ambiguity_behavior": "FAIL_CLOSED",
      "fail_closed": true
    },
    {
      "procedure_id": "DIGEST_RECOMPUTE",
      "arguments": [
        {
          "name": "registry",
          "kind": "REGISTRY",
          "required": true,
          "cardinality": "ONE"
        },
        {
          "name": "package",
          "kind": "PACKAGE",
          "required": true,
          "cardinality": "ONE"
        },
        {
          "name": "canonicalization",
          "kind": "CANONICALIZATION",
          "required": true,
          "cardinality": "ONE"
        }
      ],
      "derivation": {
        "operation": "DIGEST_RECOMPUTE",
        "objects": "registry:/objects/*",
        "self_digest_contract": "canonicalization:/reduction",
        "package_integrity": "package:/current_candidate_integrity"
      },
      "result": {
        "type": "BOOLEAN",
        "status": [
          "PASS",
          "FAIL"
        ],
        "witness_required": true
      },
      "missing_behavior": "FAIL_CLOSED",
      "ambiguity_behavior": "FAIL_CLOSED",
      "fail_closed": true
    },
    {
      "procedure_id": "SET_EQUALITY",
      "arguments": [
        {
          "name": "inputs",
          "kind": "NORMATIVE_INPUTS",
          "required": true,
          "cardinality": "ONE"
        }
      ],
      "derivation": {
        "operation": "SET_EQUALITY",
        "left": {
          "source": "inputs:/rule_dependencies/*",
          "projection": [
            "rule_id",
            "depends_on/*"
          ]
        },
        "right": {
          "source": "inputs:/dependency_edges/*",
          "projection": [
            "from",
            "to"
          ]
        },
        "comparison": "SET_EQUAL"
      },
      "result": {
        "type": "BOOLEAN",
        "status": [
          "PASS",
          "FAIL"
        ],
        "witness_required": true
      },
      "missing_behavior": "FAIL_CLOSED",
      "ambiguity_behavior": "FAIL_CLOSED",
      "fail_closed": true
    },
    {
      "procedure_id": "EXPECTATION_STABILITY",
      "arguments": [
        {
          "name": "inputs",
          "kind": "NORMATIVE_INPUTS",
          "required": true,
          "cardinality": "ONE"
        },
        {
          "name": "accepted_vectors",
          "kind": "SOURCE_VECTOR_CATALOG",
          "required": true,
          "cardinality": "ONE"
        }
      ],
      "derivation": {
        "operation": "SET_EQUALITY",
        "left": {
          "source": "inputs:/vector_expectations/*",
          "key": "vector_id",
          "value": "expected"
        },
        "right": {
          "source": "accepted_vectors:/vectors/*",
          "key": "vector_id",
          "value": "expected"
        },
        "comparison": "MAP_EQUAL"
      },
      "result": {
        "type": "BOOLEAN",
        "status": [
          "PASS",
          "FAIL"
        ],
        "witness_required": true
      },
      "missing_behavior": "FAIL_CLOSED",
      "ambiguity_behavior": "FAIL_CLOSED",
      "fail_closed": true
    },
    {
      "procedure_id": "PREDICATE_POLICY_AGREEMENT",
      "arguments": [
        {
          "name": "inputs",
          "kind": "NORMATIVE_INPUTS",
          "required": true,
          "cardinality": "ONE"
        },
        {
          "name": "authority",
          "kind": "AUTHORITY",
          "required": true,
          "cardinality": "ONE"
        }
      ],
      "derivation": {
        "operation": "POLICY_AGREEMENT",
        "comparisons": [
          {
            "left": "inputs:/predicate_policy/global_stage_order",
            "right": "authority:/stage_policy_requirements/global_stage_order",
            "authorized_by": "authority:/stage_policy_authorization/global_stage_order"
          },
          {
            "left": "inputs:/predicate_policy/implicit_transitivity",
            "right": "authority:/stage_policy_requirements/implicit_transitivity",
            "authorized_by": "authority:/stage_policy_authorization/implicit_transitivity"
          }
        ]
      },
      "result": {
        "type": "BOOLEAN",
        "status": [
          "PASS",
          "FAIL"
        ],
        "witness_required": true
      },
      "missing_behavior": "FAIL_CLOSED",
      "ambiguity_behavior": "FAIL_CLOSED",
      "fail_closed": true
    },
    {
      "procedure_id": "CANONICALIZATION_PROFILE_WELLFORMED",
      "arguments": [
        {
          "name": "profile",
          "kind": "CANONICALIZATION",
          "required": true,
          "cardinality": "ONE"
        },
        {
          "name": "authority",
          "kind": "AUTHORITY",
          "required": true,
          "cardinality": "ONE"
        }
      ],
      "derivation": {
        "operation": "POLICY_AGREEMENT",
        "comparisons": [
          {
            "left": "profile:/standard",
            "right": "authority:/canonicalization_requirements/standard"
          },
          {
            "left": "profile:/serialization",
            "right": "authority:/canonicalization_requirements/serialization"
          },
          {
            "left": "profile:/encoding",